{
    "creator": "BOOBOO",
    "description": "BOOBOO desc",
    "format": "HIP412@1.0.0",
    "name": "HANGRY BARBOON #2343",
    "image": "ipfs://QmaHVnnp7qAmGADa3tQfWVNxxZDRmTL5r6jKrAo16mSd5y/2343.png",
    "type": "image/png",
    "properties": { "edition": 2343 },
    "attributes": [
      { "trait_type": "Background", "value": "Green" },
      { "trait_type": "Fur", "value": "Gold" },
      { "trait_type": "Clothing", "value": "Floral Jacket" },
      { "trait_type": "Mouth", "value": "Tongue" },
      { "trait_type": "Sing", "value": "None" }
    ]
}